{
  "$schema": "http://json-schema.org/draft-07/schema",
  "$id": "dashboard-schema-v1",
  "type": "object",
  "title": "Dashboard template schema",
  "description": "Schema used to verify that a given dashboard template is valid.",
  "required": [
    "name",
    "pages"
  ],
  "properties": {
    "name": {
      "$id": "#/properties/name",
      "type": "string",
      "title": "The name of the dashboard"
    },
    "description": {
      "$id": "#/properties/description",
      "type": ["string", "null"],
      "title": "Description of the dashboard contents"
    },
    "permissions": {
      "$id": "#/properties/permissions",
      "type": "string",
      "title": "The permissions of the dashboard"
    },
    "pages": {
      "$id": "#/properties/pages",
      "type": "array",
      "title": "The pages that form the dashboard",
      "minItems": 1,
      "maxItems": 1,
      "items": {
        "$id": "#/properties/pages/items",
        "anyOf": [{
          "$id": "#/properties/pages/items/anyOf/0",
          "type": "object",
          "title": "The contents of a dashboard's page",
          "required": [
            "name",
            "widgets"
          ],
          "properties": {
            "name": {
              "$id": "#/properties/pages/items/anyOf/0/properties/name",
              "type": "string",
              "title": "The name of the dashboard page"
            },
            "description": {
              "$id": "#/properties/pages/items/anyOf/0/properties/description",
              "type": ["string", "null"],
              "title": "Description of the dashboard's page contents"
            },
            "widgets": {
              "$id": "#/properties/pages/items/anyOf/0/properties/widgets",
              "type": "array",
              "title": "The widgets that form the dashboard",
              "items": {
                "$id": "#/properties/pages/items/anyOf/0/properties/widgets/items",
                "anyOf": [{
                  "$id": "#/properties/pages/items/anyOf/0/properties/widgets/items/anyOf/0",
                  "type": "object",
                  "title": "The widget definition",
                  "required": [
                    "visualization",
                    "layout",
                    "title",
                    "rawConfiguration"
                  ],
                  "properties": {
                    "linkedEntityGuids": {
                      "$id": "#/properties/pages/items/anyOf/0/properties/widgets/items/anyOf/0/properties/linkedEntityGuids",
                      "type": "null",
                      "title": "The linked entity guids",
                      "description": "Unsupported guids of linked entities. Only allowed with a null value. The dashboard exporter will always provide the field, so it's quite common that it is present. It is inconvenient to remove those fields manually, so it's syntactically allowed but only with a null value.",
                      "const": null
                    },
                    "visualization": {
                      "$id": "#/properties/pages/items/anyOf/0/properties/widgets/items/anyOf/0/properties/visualization",
                      "type": "object",
                      "title": "The visualization type",
                      "required": [
                        "id"
                      ],
                      "properties": {
                        "id": {
                          "$id": "#/properties/pages/items/anyOf/0/properties/widgets/items/anyOf/0/properties/visualization/properties/id",
                          "type": "string",
                          "title": "The id of the visualization"
                        }
                      },
                      "additionalProperties": true
                    },
                    "layout": {
                      "$id": "#/properties/pages/items/anyOf/0/properties/widgets/items/anyOf/0/properties/layout",
                      "type": "object",
                      "title": "The layout of the widget",
                      "required": [
                        "column",
                        "row",
                        "height",
                        "width"
                      ],
                      "properties": {
                        "column": {
                          "$id": "#/properties/pages/items/anyOf/0/properties/widgets/items/anyOf/0/properties/layout/properties/column",
                          "type": "integer",
                          "title": "The column position"
                        },
                        "row": {
                          "$id": "#/properties/pages/items/anyOf/0/properties/widgets/items/anyOf/0/properties/layout/properties/row",
                          "type": "integer",
                          "title": "The row position"
                        },
                        "height": {
                          "$id": "#/properties/pages/items/anyOf/0/properties/widgets/items/anyOf/0/properties/layout/properties/height",
                          "type": "integer",
                          "title": "The height"
                        },
                        "width": {
                          "$id": "#/properties/pages/items/anyOf/0/properties/widgets/items/anyOf/0/properties/layout/properties/width",
                          "type": "integer",
                          "title": "The width"
                        }
                      },
                      "additionalProperties": true
                    },
                    "title": {
                      "$id": "#/properties/pages/items/anyOf/0/properties/widgets/items/anyOf/0/properties/title",
                      "type": "string",
                      "title": "The title of the widget"
                    },
                    "rawConfiguration": {
                      "$id": "#/properties/pages/items/anyOf/0/properties/widgets/items/anyOf/0/properties/rawConfiguration",
                      "type": "object",
                      "title": "The configuration of the widget",
                      "oneOf": [
                        {
                          "required": ["nrqlQueries"]
                        },
                        {
                          "required": ["text"]
                        }
                      ],
                      "not": {
                        "required": ["metrics"]
                      },
                      "properties": {
                        "dataFormatters": {
                          "$id": "#/properties/pages/items/anyOf/0/properties/widgets/items/anyOf/0/properties/rawConfiguration/properties/dataFormatters",
                          "type": "array",
                          "title": "Data formatting information",
                          "items": {
                            "$id": "#/properties/pages/items/anyOf/0/properties/widgets/items/anyOf/0/properties/rawConfiguration/properties/dataFormatters/items",
                            "anyOf": [{
                              "$id": "#/properties/pages/items/anyOf/0/properties/widgets/items/anyOf/0/properties/rawConfiguration/properties/dataFormatters/items/anyOf/0",
                              "type": "object",
                              "required": [
                                "name",
                                "type"
                              ],
                              "properties": {
                                "name": {
                                  "$id": "#/properties/pages/items/anyOf/0/properties/widgets/items/anyOf/0/properties/rawConfiguration/properties/dataFormatters/items/anyOf/0/properties/name",
                                  "type": "string"
                                },
                                "type": {
                                  "$id": "#/properties/pages/items/anyOf/0/properties/widgets/items/anyOf/0/properties/rawConfiguration/properties/dataFormatters/items/anyOf/0/properties/type",
                                  "type": "string"
                                }
                              },
                              "additionalProperties": true
                            }]
                          }
                        },
                        "nrqlQueries": {
                          "$id": "#/properties/pages/items/anyOf/0/properties/widgets/items/anyOf/0/properties/rawConfiguration/properties/nrqlQueries",
                          "type": "array",
                          "title": "The NRQL query defined for the widget.",
                          "items": {
                            "$id": "#/properties/pages/items/anyOf/0/properties/widgets/items/anyOf/0/properties/rawConfiguration/properties/nrqlQueries/items",
                            "anyOf": [{
                              "$id": "#/properties/pages/items/anyOf/0/properties/widgets/items/anyOf/0/properties/rawConfiguration/properties/nrqlQueries/items/anyOf/0",
                              "type": "object",
                              "required": [
                                "accountId",
                                "query"
                              ],
                              "properties": {
                                "accountId": {
                                  "$id": "#/properties/pages/items/anyOf/0/properties/widgets/items/anyOf/0/properties/rawConfiguration/properties/nrqlQueries/items/anyOf/0/properties/accountId",
                                  "type": "integer",
                                  "title": "The accountId to get data from",
                                  "minimum": 0,
                                  "maximum": 0
                                },
                                "query": {
                                  "$id": "#/properties/pages/items/anyOf/0/properties/widgets/items/anyOf/0/properties/rawConfiguration/properties/nrqlQueries/items/anyOf/0/properties/query",
                                  "type": "string",
                                  "title": "The query to execute"
                                }
                              },
                              "additionalProperties": true
                            }]
                          }
                        },
                        "text": {
                          "$id": "#/properties/pages/items/anyOf/0/properties/widgets/items/anyOf/0/properties/rawConfiguration/properties/text",
                          "type": "string"
                        },
                        "thresholds": {
                          "$id": "#/properties/pages/items/anyOf/0/properties/widgets/items/anyOf/0/properties/rawConfiguration/properties/thresholds",
                          "type": "array",
                          "items": {
                            "$id": "#/properties/pages/items/anyOf/0/properties/widgets/items/anyOf/0/properties/rawConfiguration/properties/thresholds/items"
                          }
                        }
                      },
                      "additionalProperties": true
                    }
                  },
                  "additionalProperties": true
                }]
              }
            }
          },
          "additionalProperties": true
        }]
      }
    }
  },
  "additionalProperties": false
}