{
	"name": "Oracle Database Status",
	"description": null,
	"permissions": "PUBLIC_READ_WRITE",
	"pages": [{
		"name": "Oracle Database Status",
		"description": null,
		"widgets": [{
				"visualization": {
					"id": "viz.table"
				},
				"layout": {
					"column": 1,
					"row": 1,
					"height": 3,
					"width": 7
				},
				"title": "Oracle Server Onboarding ",
				"rawConfiguration": {
					"dataFormatters": [],
					"facet": {
						"showOtherSeries": true
					},
					"nrqlQueries": [{
						"accountId": 0,
						"query": "select latest(timestamp) from Oracle FACET hostname, database, instance_name, instance_mode, database_status SINCE 1 hour ago LIMIT MAX "
					}]
				}
			},
			{
				"visualization": {
					"id": "viz.table"
				},
				"layout": {
					"column": 8,
					"row": 1,
					"height": 3,
					"width": 3
				},
				"title": "Oracle Server Onboarding Status",
				"rawConfiguration": {
					"dataFormatters": [],
					"facet": {
						"showOtherSeries": false
					},
					"nrqlQueries": [{
						"accountId": 0,
						"query": "SELECT latest(timestamp) from Oracle FACET databaseHost LIMIT MAX since 1 hour ago"
					}]
				}
			},
			{
				"visualization": {
					"id": "viz.billboard"
				},
				"layout": {
					"column": 11,
					"row": 1,
					"height": 3,
					"width": 2
				},
				"title": "Oracle Database Host Count",
				"rawConfiguration": {
					"dataFormatters": [],
					"nrqlQueries": [{
						"accountId": 0,
						"query": "SELECT uniqueCount(databaseHost) from Oracle"
					}],
					"thresholds": []
				}
			},
			{
				"visualization": {
					"id": "viz.line"
				},
				"layout": {
					"column": 1,
					"row": 4,
					"height": 3,
					"width": 4
				},
				"title": "Average PGA Allocated ",
				"rawConfiguration": {
					"legend": {
						"enabled": true
					},
					"nrqlQueries": [{
						"accountId": 0,
						"query": "select latest(value) from Oracle where metric_name = 'Total PGA Allocated' facet metric_name, database, hostname   TIMESERIES  limit 1000"
					}],
					"yAxisLeft": {
						"zero": true
					}
				}
			},
			{
				"visualization": {
					"id": "viz.line"
				},
				"layout": {
					"column": 5,
					"row": 4,
					"height": 3,
					"width": 4
				},
				"title": "Avergae User Calls Per Second",
				"rawConfiguration": {
					"dataFormatters": [],
					"legend": {
						"enabled": true
					},
					"nrqlQueries": [{
						"accountId": 0,
						"query": "select latest(value) from Oracle where metric_name = 'User Calls Per Sec'  facet metric_name, database, hostname TIMESERIES    limit 1000"
					}],
					"yAxisLeft": {
						"zero": true
					}
				}
			},
			{
				"visualization": {
					"id": "viz.line"
				},
				"layout": {
					"column": 9,
					"row": 4,
					"height": 3,
					"width": 4
				},
				"title": "Average Temp Space",
				"rawConfiguration": {
					"legend": {
						"enabled": true
					},
					"nrqlQueries": [{
						"accountId": 0,
						"query": "select latest(value) from Oracle where metric_name ='Temp Space Used' facet metric_name, database, hostname   TIMESERIES  limit 1000"
					}],
					"yAxisLeft": {
						"zero": true
					}
				}
			},
			{
				"visualization": {
					"id": "viz.line"
				},
				"layout": {
					"column": 1,
					"row": 7,
					"height": 3,
					"width": 4
				},
				"title": "Average Session Count",
				"rawConfiguration": {
					"dataFormatters": [],
					"legend": {
						"enabled": true
					},
					"nrqlQueries": [{
						"accountId": 0,
						"query": "select latest(value) from Oracle where metric_name = 'Session Count'  facet metric_name, database, hostname TIMESERIES limit 1000"
					}],
					"yAxisLeft": {
						"zero": true
					}
				}
			},
			{
				"visualization": {
					"id": "viz.line"
				},
				"layout": {
					"column": 5,
					"row": 7,
					"height": 3,
					"width": 4
				},
				"title": "Average Cell Physical IO Interconnect Bytes",
				"rawConfiguration": {
					"legend": {
						"enabled": true
					},
					"nrqlQueries": [{
						"accountId": 0,
						"query": "select latest(value) from Oracle where metric_name = 'Cell Physical IO Interconnect Bytes'  facet metric_name, database, hostname   TIMESERIES  limit 1000"
					}],
					"yAxisLeft": {
						"zero": true
					}
				}
			},
			{
				"visualization": {
					"id": "viz.line"
				},
				"layout": {
					"column": 9,
					"row": 7,
					"height": 3,
					"width": 4
				},
				"title": "Average CPU Usage Per Txn",
				"rawConfiguration": {
					"dataFormatters": [],
					"legend": {
						"enabled": true
					},
					"nrqlQueries": [{
						"accountId": 0,
						"query": "select average(value) from Oracle where metric_name = 'CPU Usage Per Txn'  facet metric_name, database, hostname  TIMESERIES 2 minutes   limit 1000"
					}],
					"yAxisLeft": {
						"zero": true
					}
				}
			},
			{
				"visualization": {
					"id": "viz.line"
				},
				"layout": {
					"column": 1,
					"row": 10,
					"height": 3,
					"width": 4
				},
				"title": "Average Response Time Per Txn",
				"rawConfiguration": {
					"dataFormatters": [],
					"legend": {
						"enabled": true
					},
					"nrqlQueries": [{
						"accountId": 0,
						"query": "select average(value) from Oracle where metric_name = 'Response Time Per Txn'  facet metric_name, database, hostname  TIMESERIES   limit 1000"
					}],
					"yAxisLeft": {
						"zero": true
					}
				}
			},
			{
				"visualization": {
					"id": "viz.line"
				},
				"layout": {
					"column": 5,
					"row": 10,
					"height": 3,
					"width": 4
				},
				"title": "Average DB Block Changes per Txn",
				"rawConfiguration": {
					"dataFormatters": [],
					"legend": {
						"enabled": true
					},
					"nrqlQueries": [{
						"accountId": 0,
						"query": "select average(value) from Oracle where metric_name = 'DB Block Changes Per Txn' facet metric_name, database, hostname   TIMESERIES  limit 1000"
					}],
					"yAxisLeft": {
						"zero": true
					}
				}
			},
			{
				"visualization": {
					"id": "viz.line"
				},
				"layout": {
					"column": 9,
					"row": 10,
					"height": 3,
					"width": 4
				},
				"title": "Avg Response Time Per Txn",
				"rawConfiguration": {
					"dataFormatters": [],
					"legend": {
						"enabled": true
					},
					"nrqlQueries": [{
						"accountId": 0,
						"query": "select average(value) from Oracle where metric_name = 'Response Time Per Txn' facet metric_name, database, hostname  TIMESERIES   limit 1000"
					}],
					"yAxisLeft": {
						"zero": true
					}
				}
			},
			{
				"visualization": {
					"id": "viz.line"
				},
				"layout": {
					"column": 1,
					"row": 13,
					"height": 3,
					"width": 4
				},
				"title": "Avg Physical Write Per Txn",
				"rawConfiguration": {
					"dataFormatters": [],
					"legend": {
						"enabled": true
					},
					"nrqlQueries": [{
						"accountId": 0,
						"query": "select average(value) from Oracle where metric_name = 'Physical Writes Per Txn'  facet metric_name, database, hostname TIMESERIES    limit 1000"
					}],
					"yAxisLeft": {
						"zero": true
					}
				}
			},
			{
				"visualization": {
					"id": "viz.line"
				},
				"layout": {
					"column": 5,
					"row": 13,
					"height": 3,
					"width": 4
				},
				"title": "Avg DB wait time ",
				"rawConfiguration": {
					"dataFormatters": [],
					"legend": {
						"enabled": true
					},
					"nrqlQueries": [{
						"accountId": 0,
						"query": "select average(value) from Oracle where metric_name = 'Database Wait Time Ratio'  facet metric_name, database, hostname TIMESERIES  2 minutes limit 1000"
					}],
					"yAxisLeft": {
						"zero": true
					}
				}
			},
			{
				"visualization": {
					"id": "viz.line"
				},
				"layout": {
					"column": 1,
					"row": 16,
					"height": 3,
					"width": 4
				},
				"title": "Avg Physical Write Per Txn",
				"rawConfiguration": {
					"dataFormatters": [],
					"legend": {
						"enabled": true
					},
					"nrqlQueries": [{
						"accountId": 0,
						"query": "select average(value) from Oracle where metric_name = 'Physical Writes Per Txn'  facet metric_name, database, hostname TIMESERIES    limit 1000"
					}],
					"yAxisLeft": {
						"zero": true
					}
				}
			},
			{
				"visualization": {
					"id": "viz.line"
				},
				"layout": {
					"column": 5,
					"row": 16,
					"height": 3,
					"width": 4
				},
				"title": "Avg DB wait time ",
				"rawConfiguration": {
					"dataFormatters": [],
					"legend": {
						"enabled": true
					},
					"nrqlQueries": [{
						"accountId": 0,
						"query": "select average(value) from Oracle where metric_name = 'Database Wait Time Ratio'  facet metric_name, database, hostname TIMESERIES  2 minutes limit 1000"
					}],
					"yAxisLeft": {
						"zero": true
					}
				}
			},
			{
				"visualization": {
					"id": "viz.table"
				},
				"layout": {
					"column": 9,
					"row": 19,
					"height": 3,
					"width": 4
				},
				"title": "Latest Tablespace Usage",
				"rawConfiguration": {
					"dataFormatters": [],
					"facet": {
						"showOtherSeries": false
					},
					"nrqlQueries": [{
						"accountId": 0,
						"query": "select latest(used_percent) from Oracle where queryName = 'Tablespace_metric' facet hostname, databaseHost,tablespace_name, database since 30 minutes ago limit max"
					}]
				}
			}
		]
	}]
}